{
  "$schema": "https://json-schema.org/draft/2020-12/schema",
  "title": "Backlog — Roadmap",
  "description": "Step-4 backlog index: the project's epics, each with its dependency-ordered list of ticket ids. Points at the spec it was sliced from. The ticket detail lives in tickets/<ID>.json.",
  "type": "object",
  "required": ["project", "version", "epics"],
  "properties": {
    "project": { "type": "string", "description": "Project name." },
    "version": { "type": "string", "description": "Blueprint version, e.g. 'v1'." },
    "spec": { "type": "string", "description": "Relative path to the /spec epic plan this backlog was sliced from." },
    "epics": {
      "type": "array",
      "description": "The epics in this project. Usually one per validating loop at MVP.",
      "items": {
        "type": "object",
        "required": ["id", "name", "status", "goal", "tickets"],
        "properties": {
          "id": { "type": "string", "description": "Stable kebab-case epic id (e.g. 'daily-pick-loop')." },
          "name": { "type": "string", "description": "Human-readable epic name." },
          "status": {
            "type": "string",
            "enum": ["todo", "in_progress", "done", "blocked"],
            "description": "Epic lifecycle state."
          },
          "goal": { "type": "string", "description": "One-sentence epic goal." },
          "tickets": {
            "type": "array",
            "description": "Ticket ids in dependency order (enablers first, then stories). Each must have a matching tickets/<ID>.json.",
            "items": { "type": "string" }
          }
        }
      }
    },
    "_note": { "type": "string", "description": "Free-text note on slicing rationale or ordering." }
  }
}
